{
  "name": "Customer",
  "fields": [
    {
      "name": "name",
      "type": "string",
      "required": true
    },
    {
      "name": "email",
      "type": "string",
      "required": true
    },
    {
      "name": "registeredAt",
      "type": "datetime"
    }
  ],
  "auditable": true,
  "softDelete": true
}
